170,HRX by Hrithik Roshan,Men Grey Solid Hooded Bomber Jacket,Rs. 1999,,Regular,,,Solid,Zip,,,,11846958,,Hooded,Polyester,3,Long Sleeves,Bomber,,,
171,HERE&amp;NOW,Men Black Self Design Bomber Jacket,Rs. 2649,,Regular,,,Self Design,Zip,,,,12007888,,Stand Collar,Polyester,2,Long Sleeves,Bomber,,,
172,WROGN,Men Navy Blue Slim Fit Solid Bomber Jacket,Rs. 1924,,Regular,,,Solid,Zip,,,,10187067,,Mock Collar,Polyester,3,Long Sleeves,Bomber,,,
173,Nike,Men Black &amp; Grey AS M NSW HE VEST WINTER Colourblocked Sporty Jacket,Rs. 2997,,Regular,,,Colourblocked,Zip,,,,10851860,,Mock Collar,Polyester,3,Sleeveless,Sporty Jacket,,,
174,Roadster,Men Black Packable Puffer Jacket,Rs. 799,,Regular,,,Solid,Zip,,,,11815684,,Mock Collar,Nylon,2,Long Sleeves,Puffer Jacket,,,
175,HRX by Hrithik Roshan,Active Men Burgundy Solid Bomber Jacket,Rs. 1799,,Regular,,,Solid,Zip,,,,9298165,,Mandarin Collar,Polyester,5,Long Sleeves,Bomber,,,
176,Campus Sutra,Men Blue Solid Varsity Jacket,Rs. 799,,Regular,,,Solid,Zip,,,,6996811,,Stand Collar,Cotton,2,Long Sleeves,Varsity Jacket,,,
177,Allen Solly Sport,Men Charcoal Grey Solid Bomber Jacket,Rs. 1499,,Regular,,,Solid,Zip,,,,10656358,,Mock Collar,Polyester,3,Long Sleeves,Bomber,,,
178,Roadster,Men Black Solid Lightweight Bomber Jacket,Rs. 1249,,Regular,,,Solid,Zip,,,,10091939,,Stand Collar,Polyester,,Long Sleeves,Bomber,,,Lightweight
179,Mast &amp; Harbour,Men White Solid Bomber Jacket,Rs. 1999,,Regular,,,Solid,Zip,,,,12108250,,Stand Collar,Polyester,2,Long Sleeves,Bomber,,,
180,HIGHLANDER,Men Black Solid Padded Jacket,Rs. 1279,,Regular,,,Solid,Zip,,,,11177252,,Mock Collar,Unlined,2,Long Sleeves,Padded Jacket,,,
181,Crimsoune Club,Men Black Solid Padded Jacket,Rs. 3199,,Regular,,,Solid,Zip,,,,12753250,,Hooded,Polyester,2,Long Sleeves,Padded Jacket,,,
182,Roadster,Men Navy Blue Solid Quilted Jacket with Detachable Hood,Rs. 1349,,Regular,,,Solid,Zip,,,,10968442,,Hooded,Polyester,3,Long Sleeves,Quilted Jacket,,,
183,Puma,Men Black Scuderia Ferrari Race T7 Solid Track Jacket,Rs. 4549,,Regular,,,Solid,Zip,,,,12351372,,Mock Collar,Unlined,2,Long Sleeves,Sporty Jacket,,,
184,Sztori,Plus Size Men Black Solid Padded Jacket,Rs. 1199,,Regular,,,Solid,Zip,,,,11881482,,Mock Collar,Polyester,3,Long Sleeves,Padded Jacket,,,
185,WROGN,Men Black Solid Biker Jacket,Rs. 2529,,Regular,,,Solid,Zip,,,,10187181,,Stand Collar,Polyester,5,Long Sleeves,Biker Jacket,,,
186,Roadster,Men Brown Solid Detachable Hooded Padded Jacket,Rs. 1484,,Regular,,,Solid,Zip,,,,12111478,,Hooded,Polyester,3,Long Sleeves,Padded Jacket,,,
187,Maniac,Men Charcoal Grey Striped Bomber,Rs. 999,,Regular,,,Striped,Zip,,,,7289784,,Mandarin Collar,Unlined,2,Long Sleeves,Bomber,,,
188,Fort Collins,Men Grey Solid Puffer Jacket with Detachable Hood,Rs. 1619,,Regular,,,Solid,Zip,,,,10736658,,Hooded,Polyester,4,Long Sleeves,Puffer Jacket,,,
189,Nike,Men Grey NK DRY HDIE Dri-Fit Solid Sporty Jacket,Rs. 2796,,Regular,,,Solid,Zip,,,,10720582,,Hooded,Polyester,2,Long Sleeves,Sporty Jacket,,,
190,Roadster,Men Burgundy Solid Puffer Jacket,Rs. 2149,,Regular,,,Solid,Zip,,,,9564449,,Mock Collar,Polyester,2,Long Sleeves,Puffer Jacket,,,
191,HERE&amp;NOW,Men Mustard Yellow &amp; Navy Colourblocked Bomber,Rs. 1664,,Regular,,,Colourblocked,Zip,,,,7201559,,Mock Collar,Polyester,2,Long Sleeves,Bomber,,,
192,HRX by Hrithik Roshan,Men Jet Black Solid Rapid-Dry Antimicrobial Running Jacket,Rs. 1999,,Regular,,,Solid,Zip,,,,11953072,,Mock Collar,Unlined,,Long Sleeves,Sporty Jacket,Straight,,
193,Blue Saint,Men Black Solid Denim Jacket,Rs. 1444,,Regular,,,Solid,Button,,,,9823447,,Spread Collar,Cotton,4,Long Sleeves,Denim Jacket,,,
194,HERE&amp;NOW,Men Navy Blue Solid Tailored Jacket,Rs. 2204,,Regular,,,Solid,Zip,,,,12007904,,Spread Collar,Polyester,4,Long Sleeves,Tailored Jacket,,,
195,Allen Solly,Men Olive Green Solid Reversible Jacket,Rs. 5279,,Regular,,,Solid,Zip,,,,10565136,,Mock Collar,Unlined,,Long Sleeves,Padded Jacket,,,Reversible
196,Roadster,Men Navy Blue Solid Padded Jacket With Detachable Hood,Rs. 1519,,Regular,,,Solid,Zip,,,,12111338,,Hooded,Polyester,3,Long Sleeves,Padded Jacket,,,
197,HIGHLANDER,Men Blue Camouflage Printed Hooded Denim Jacket,Rs. 1599,,Regular,,,Camouflage,Button,,,,11180950,,Hooded,Unlined,4,Long Sleeves,Denim Jacket,,,
198,WROGN,Men Black Solid Slim Fit Denim Jacket,Rs. 2159,,Regular,,,Solid,Button,,,,12421894,,Spread Collar,Cotton,2,Long Sleeves,Denim Jacket,,,
199,Roadster,Men Khaki Solid Padded Jacket with Detachable Hood,Rs. 1799,,Regular,,,Solid,Zip,,,,11970222,,Hooded,Polyester,4,Long Sleeves,Padded Jacket,,,
200,HRX by Hrithik Roshan,Men Blue Solid Sporty Jacket,Rs. 1169,,Regular,,,Solid,Zip,,,,2170645,,Mock Collar,Fleece,2,Long Sleeves,Sporty Jacket,,,
201,HERE&amp;NOW,Men Teal Blue Solid Puffer Jacket,Rs. 1372,,Regular,,,Solid,Zip,,,,7201630,,Mock Collar,Polyester,3,Long Sleeves,Puffer Jacket,,,
202,Sztori,Plus Size Men Grey Solid Tailored Jacket,Rs. 1349,,Regular,,,Solid,Zip,,,,11881098,,Mock Collar,Polyester,3,Long Sleeves,Tailored Jacket,,,
203,Mast &amp; Harbour,Men Navy Solid Lightweight Sporty Jacket,Rs. 679,,Regular,,,Solid,Zip,,,,2013386,,Mock Collar,Unlined,,Long Sleeves,Sporty Jacket,,,Lightweight
204,Allen Solly,Men Navy Blue Solid Bomber Jacket,Rs. 2379,,Regular,,,Solid,Zip,,,,10646188,,Mock Collar,Polyester,3,Long Sleeves,Bomber,,,
205,Allen Solly Sport,Men Black Solid Quilted Jacket,Rs. 1799,,Regular,,,Solid,Zip,,,,10656368,,Mock Collar,Polyester,3,Long Sleeves,Quilted Jacket,,,
206,Puma,Men Black Evostripe Solid Slim Fit Track Jacket,Rs. 3574,,Regular,,,Solid,Zip,,,,12335136,,Mock Collar,Polycotton,2,Long Sleeves,Sporty Jacket,,,
207,Van Heusen,Men Grey Solid Sporty Jacket,Rs. 2699,,Regular,,,Solid,Zip,,,,10780172,,Mock Collar,Unlined,2,Long Sleeves,Sporty Jacket,,,
208,HERE&amp;NOW,Men Mustard Yellow Solid Padded Jacket,Rs. 1999,,Regular,,,Solid,Zip,,,,12007890,,Mock Collar,Polyester,5,Sleeveless,Padded Jacket,,,
209,Roadster,Men Navy Blue Solid Quilted Jacket,Rs. 1999,,Regular,,,Solid,Zip,,,,12111364,,Mock Collar,Polyester,3,Long Sleeves,Quilted Jacket,,,
210,Fort Collins,Men Teal Blue Solid Bomber Jacket,Rs. 1274,,Regular,,,Solid,Zip,,,,10630050,,Mock Collar,Polyester,4,Long Sleeves,Bomber,,,
211,HERE&amp;NOW,Men Brown Solid Biker Jacket,Rs. 2452,,Regular,,,Solid,Zip,,,,10032701,,Mock Collar,Polyester,3,Long Sleeves,Biker Jacket,,,
212,Roadster,Men Mustard Yellow &amp; Black Colourblocked Hooded Padded Jacket,Rs. 1999,,Regular,,,Colourblocked,Zip,,,,12111616,,Hooded,Polyester,3,Long Sleeves,Padded Jacket,,,
213,Ecko Unltd,Men Solid Denim Jacket,Rs. 1331,,Regular,,,Solid,Zip,,,,11002860,,Mock Collar,Unlined,4,Long Sleeves,Denim Jacket,,,
214,High Star,Men Black Solid Denim Jacket,Rs. 1039,,Regular,,,,Button,,,,11704166,,Spread Collar,Unlined,4,Long Sleeves,Denim Jacket,Straight,,
215,Van Heusen,Men Navy Blue Solid Sporty Jacket,Rs. 2699,,Regular,,,Solid,Zip,,,,10780014,,Mock Collar,Unlined,2,Long Sleeves,Sporty Jacket,,,
216,Mast &amp; Harbour,Men Burgundy Solid Lightweight Bomber Jacket,Rs. 1239,,Regular,,,Solid,Zip,,,,11973124,,Stand Collar,Polyester,,Long Sleeves,Bomber,,,Lightweight
217,Roadster,Men Black Solid Puffer Jacket,Rs. 2024,,Regular,,,Solid,Zip,,,,9564251,,Hooded,Polyester,4,Long Sleeves,Puffer Jacket,,,
218,HIGHLANDER,Men Blue Solid Denim Hooded Jacket,Rs. 1659,,Regular,,,Solid,Button,,,,10866032,,Hooded,Unlined,4,Long Sleeves,Denim Jacket,,,
219,Roadster,Men Grey Solid Hooded Quilted Jacket,Rs. 1999,,Regular,,,Solid,Zip,,,,12111508,,Hooded,Polyester,3,Sleeveless,Quilted Jacket,,,
220,Allen Solly Sport,Wimbledon Men Charcoal Grey Solid Bomber Jacket,Rs. 1499,,Regular,,,Solid,Zip,,,,10533040,,Mock Collar,Polyester,3,Long Sleeves,Bomber,,,
221,Roadster,Men Navy Blue Solid Denim Jacket,Rs. 1959,,Regular,,,Solid,Button,,,,10617856,,Spread Collar,Unlined,2,Long Sleeves,Denim Jacket,,,
222,WROGN,Men Olive Green Slim Fit Solid Bomber Jacket,Rs. 2089,,Regular,,,Solid,Zip,,,,12422118,,Stand Collar,Polyester,3,Long Sleeves,Bomber,,,
223,Nike,Men Black &amp; Grey AS M NSW HE VEST WINTER Colourblocked Sporty Jacket,Rs. 2997,,Regular,,,Colourblocked,Zip,,,,10851860,,Mock Collar,Polyester,3,Sleeveless,Sporty Jacket,,,
224,HERE&amp;NOW,Men White Solid Padded Jacket,Rs. 2199,,Regular,,,Solid,Snap Button,,,,12007966,,Mock Collar,Polyester,3,Long Sleeves,Padded Jacket,,,
225,Roadster,Men Black Solid Padded Jacket,Rs. 1999,,Regular,,,Solid,Zip,,,,9587531,,Mock Collar,Polyester,2,Long Sleeves,Padded Jacket,,,
226,ether,Men Grey Solid Bomber Jacket,Rs. 1149,,Regular,,,Solid,Zip,,,,1991228,,Mock Collar,Fleece,3,Long Sleeves,Bomber,,,
227,U.S. Polo Assn.,Men Charcoal Grey Self Design Bomber Jacket,Rs. 2399,,Regular,,,Self Design,Zip,,,,7329534,,Stand Collar,Polyester,4,Long Sleeves,Bomber,,,
228,Roadster,Men Black Solid Hooded Quilted Jacket,Rs. 1999,,Regular,,,Solid,Zip,,,,12111386,,Hooded,Polyester,3,Long Sleeves,Quilted Jacket,,,
229,Red Tape,Men Black Solid Jacket,Rs. 1080,,Regular,,,Solid,Zip,,,,10834178,,Hooded,Polyester,2,Long Sleeves,Padded Jacket,,,
230,Flying Machine,Men Brown Solid Bomber Jacket,Rs. 1999,,Regular,,,Solid,Zip,,,,10646844,,Stand Collar,Polyester,,Long Sleeves,Bomber,Straight,,
231,Crimsoune Club,Men Black Solid Padded Jacket,Rs. 3199,,Regular,,,Solid,Zip,,,,12753250,,Hooded,Polyester,2,Long Sleeves,Padded Jacket,,,
232,HRX by Hrithik Roshan,Men Black Solid Sporty Jacket,Rs. 1799,,Regular,,,Solid,Zip,,,,11846966,,Stand Collar,Polyester,2,Long Sleeves,Sporty Jacket,,,
233,Allen Solly Sport,Men Black Hooded Solid Bomber Jacket,Rs. 1749,,Regular,,,Solid,Zip,,,,10656340,,Hooded,Polyester,3,Long Sleeves,Bomber,,,
234,Campus Sutra,Men Black Solid Bomber,Rs. 1999,,Regular,,,Solid,Zip,,,,7219121,,Hooded,Cotton,2,Long Sleeves,Bomber,,,
235,WROGN,Men Olive Green Solid Slim Fit Bomber Jacket,Rs. 2034,,Regular,,,Solid,Zip,,,,10187079,,Mock Collar,Polyester,3,Long Sleeves,Bomber,,,
236,Roadster,Black &amp; Teal Blue Quilted Reversible Jacket,Rs. 1399,,Regular,,,Solid,Zip,,,,1279418,,Stand Collar,Polyester,4,Long Sleeves,Quilted Jacket,,,
237,HRX by Hrithik Roshan,Men Black Solid Rapid-Dry Antimicrobial Outdoor Jacket,Rs. 1529,,Regular,,,Solid,Zip,,,,11953428,,Hooded,Unlined,3,Long Sleeves,Sporty Jacket,,,
238,HERE&amp;NOW,Men Navy Solid Light Weight Sporty Track Jacket,Rs. 1249,,Regular,,,Solid,Zip,,,,7201577,,Mock Collar,Polyester,,Long Sleeves,Sporty Jacket,,,Lightweight
239,Nike,Men Grey NK DRY HDIE Dri-Fit Solid Sporty Jacket,Rs. 2796,,Regular,,,Solid,Zip,,,,10720582,,Hooded,Polyester,2,Long Sleeves,Sporty Jacket,,,
240,Harvard,Men Navy Blue Solid Tailored Jacket,Rs. 1439,,Regular,,,Solid,Zip,,,,2110714,,Mock Collar,Cotton,3,Long Sleeves,Tailored Jacket,,,
241,WROGN,Men Black Self Design Puffer Jacket,Rs. 2089,,Regular,,,Self Design,Zip,,,,12422062,,Hooded,Polyester,2,Long Sleeves,Puffer Jacket,,,
242,Roadster,Men Charcoal Grey Detachable Hood Solid Padded Jacket,Rs. 1484,,Regular,,,Solid,Zip,,,,12111292,,Hooded,Polyester,3,Long Sleeves,Padded Jacket,,,
243,LOCOMOTIVE,Men White Printed Denim Trucker Jacket,Rs. 1199,,Regular,,,Solid,Button,,,,10722902,,Spread Collar,Unlined,4,Long Sleeves,Denim Jacket,,,
244,HERE&amp;NOW,Men Rust Red &amp; Black Colourblocked Puffer Jacket,Rs. 2272,,Regular,,,Colourblocked,Zip,,,,10032807,,Hooded,Polyester,3,Long Sleeves,Puffer Jacket,,,
245,Roadster,Men Black Solid Lightweight Jacket,Rs. 779,,Regular,,,Solid,Zip,,,,11966728,,Mock Collar,Unlined,,Long Sleeves,Tailored Jacket,,,Lightweight
246,HIGHLANDER,Men Charcoal Grey Camouflage Printed Denim Jacket,Rs. 1359,,Regular,,,Camouflage,Button,,,,11180948,,Spread Collar,Unlined,4,Long Sleeves,Denim Jacket,,,
247,Roadster,Men Maroon Packable Puffer Jacket,Rs. 799,,Regular,,,Solid,Zip,,,,11815668,,Mock Collar,Nylon,2,Long Sleeves,Puffer Jacket,,,
248,HRX by Hrithik Roshan,Men Black Solid Active Bomber Jacket,Rs. 1934,,Regular,,,Solid,Zip,,,,9570133,,Mandarin Collar,Polyester,2,Long Sleeves,Bomber,,,
249,U.S. Polo Assn.,Men Navy Blue Solid Bomber Jacket,Rs. 2999,,Regular,,,Solid,Zip,,,,10285107,,Mandarin Collar,Polyester,2,Long Sleeves,Bomber,,,
